{
  "schema_version": 1,
  "id": "lean/list-filter-fusion",
  "record_version": 1,
  "kind": "theorem",
  "title": "Fuse two list filters into one",
  "summary": "Replace two successive Boolean filters on a Lean list with one filter using conjunction. The equality preserves the complete output list, including order and repeated elements.",
  "tags": [
    "list",
    "filter",
    "fusion",
    "boolean",
    "predicate"
  ],
  "proof_system": "Lean 4.35.0",
  "source": {
    "repository": "https://github.com/leanprover/lean4",
    "revision": "eb6cafb7290e8bd5f2937522d8d804f58f02bafc",
    "path": "src/Init/Data/List/Lemmas.lean",
    "symbol": "List.filter_filter",
    "statement": "∀ {l}, filter p (filter q l) = filter (fun a => p a && q a) l"
  },
  "assumptions": [
    "α : Type u; p q : α → Bool; l : List α. The type, predicates and list are arbitrary, with no additional hypotheses."
  ],
  "limitations": [],
  "license": {
    "spdx": "Apache-2.0",
    "url": "https://github.com/leanprover/lean4/blob/eb6cafb7290e8bd5f2937522d8d804f58f02bafc/LICENSE",
    "attribution": "Lean 4 contributors. Lemmas.lean: Copyright (c) 2014 Parikshit Khanna; authors Parikshit Khanna, Jeremy Avigad, Leonardo de Moura, Floris van Doorn, Mario Carneiro and Kim Morrison."
  },
  "owners": [
    "leanprover"
  ],
  "project": "lean/core",
  "updated": "2026-10-28",
  "reuse": "Set lean-toolchain to leanprover/lean4:v4.35.0 and import Init.Data.List.Lemmas. Supply any type α, predicates p q : α → Bool and list l : List α, then apply List.filter_filter. The outer predicate p precedes the inner predicate q in the fused Boolean conjunction."
}
