{
  "schema_version": 1,
  "id": "isabelle/sel4",
  "record_version": 2,
  "kind": "project",
  "title": "seL4 verification proofs",
  "summary": "Isabelle/HOL specifications and proofs for the seL4 microkernel, including refinement, access control, confidentiality and binary verification developments.",
  "tags": [
    "kernel",
    "operating systems",
    "refinement",
    "isabelle",
    "hardware"
  ],
  "proof_system": "Isabelle/HOL",
  "source": {
    "repository": "https://github.com/seL4/l4v",
    "revision": "3ba5789a044aba2d41afe0b108649132c506f81b",
    "path": "README.md",
    "symbol": null,
    "statement": null
  },
  "assumptions": [
    "Proof sessions use the architecture selected by L4V_ARCH and the C and Haskell specifications generated by the upstream build."
  ],
  "limitations": [],
  "license": {
    "spdx": "CC-BY-SA-4.0",
    "url": "https://github.com/seL4/l4v/blob/3ba5789a044aba2d41afe0b108649132c506f81b/LICENSE.md",
    "attribution": "README and license documentation: Copyright 2020 Data61, CSIRO, CC-BY-SA-4.0. Proofs and tools have per-file licenses, typically GPL-2.0-only or BSD-2-Clause; inspect file headers before reuse."
  },
  "owners": [
    "seL4 Foundation",
    "l4v contributors"
  ],
  "project": "isabelle/sel4",
  "updated": "2026-10-25",
  "reuse": "Follow the upstream setup guide to install the proof dependencies and Isabelle through the repo manifest. From the l4v directory, select the architecture with L4V_ARCH and run the proof suite.",
  "project_details": {
    "status": "active",
    "issues": "https://github.com/seL4/l4v/issues",
    "contributing": "https://github.com/seL4/l4v/blob/3ba5789a044aba2d41afe0b108649132c506f81b/CONTRIBUTING.md",
    "opportunities": [],
    "contents": [
      "Abstract, design-level and C specifications of the kernel.",
      "Refinement proofs, access-control proofs and information-flow proofs.",
      "Binary verification tools and proofs.",
      "capDL specifications, system-initialisation proofs and reusable Isabelle libraries."
    ],
    "documentation": "https://github.com/seL4/l4v/blob/3ba5789a044aba2d41afe0b108649132c506f81b/docs/setup.md",
    "setup": "L4V_ARCH=ARM ./run_tests"
  }
}
